{
  "$schema": "https://json-schema.org/draft/2020-12/schema",
  "$id": "https://mygridpermit.com/schema/locality-record-v1.json",
  "title": "GridPermit Locality Record",
  "description": "Master schema for every structured U.S. residential solar/battery/permitting data record — California and (starting schema v1.4.0) other states. One record = one (city, utility) pair. Produced by agents/data-collector.md. Every future page, calculator, and content-generation tool must read data through this schema, not invent its own shape. See docs/DATA_ARCHITECTURE.md.",
  "type": "object",
  "additionalProperties": false,
  "required": [
    "record_id",
    "schema_version",
    "state",
    "utility",
    "generation_supplier",
    "city",
    "county",
    "permit_authority",
    "permit_url",
    "interconnection_url",
    "battery_programs",
    "required_documents",
    "inspection_steps",
    "timeline_days",
    "eligibility_constraints",
    "permit_fees",
    "rebates",
    "official_contacts",
    "last_verified",
    "sources"
  ],
  "properties": {
    "record_id": {
      "type": "string",
      "pattern": "^[a-z]{2}(-[a-z0-9]+){3,}$",
      "description": "Naming rule: <state-code>-<county-slug>-<city-slug>-<utility-slug>, lowercase kebab-case only, no underscores. Must exactly match the record's filename (minus .json) under data/localities/. The leading 2-letter segment must equal this record's own `state` field, lowercased (enforced by scripts/validate-record.mjs, not by this regex, since the regex alone cannot tell a state-code segment from a county/city segment). Note: this pattern cannot mechanically distinguish where one segment ends and the next begins when county/city names are themselves multi-word (e.g. 'santa-clara', 'san-jose') — segment boundaries are a documentation convention (see docs/DATA_ARCHITECTURE.md), not something this regex enforces beyond overall shape."
    },
    "schema_version": {
      "type": "string",
      "const": "1.4.0",
      "description": "Version of this schema the record was produced against. 1.4.0 added `state` as a new required top-level field (plain 2-letter USPS code, e.g. 'CA', 'RI', 'DE', 'VT') so every record carries explicit state identity instead of relying on file location or record_id parsing — required for the multi-state expansion (see docs/DATA_ARCHITECTURE.md); all pre-existing California records were mechanically migrated to add \"state\": \"CA\" via scripts/migrate-add-state-field.mjs, a factual, deterministic stamp requiring no re-research. 1.4.0 also added 'puc' as a generic alternative to source.type's California-specific 'cpuc' value (kept for backward compatibility) — use 'puc' for any state's public utilities commission. 1.3.0 added value_usd_per_watt as a new optional field on programItem (battery_programs/rebates items) — additive only, not added to programItem's required list, so no existing record needed migration to remain schema-valid (all four existing records were migrated anyway, for consistency, per docs/DATA_ARCHITECTURE.md). 1.2.0 added generation_supplier and eligibility_constraints as new required fields, extended battery_programs/rebates items with effective_from/expires_on/status, and replaced required_documents' plain-string items with structured {name, required_when, source_ids} objects. 1.1.0 tightened record_id to lowercase kebab-case, no underscores. Bump on further changes; see docs/DATA_ARCHITECTURE.md for the migration rule."
    },
    "state": {
      "type": "string",
      "pattern": "^[A-Z]{2}$",
      "description": "USPS 2-letter state code this locality is in (e.g. 'CA', 'RI', 'DE', 'VT') — explicit state identity, independent of file location, folder, or record_id parsing. Must match the record_id's leading segment, lowercased (validator-enforced, see scripts/validate-record.mjs). This is a structural identity fact, not a researched fact, so it is a plain string rather than a FieldEnvelope."
    },

    "utility": { "$ref": "#/$defs/stringField" },
    "generation_supplier": {
      "allOf": [{ "$ref": "#/$defs/fieldEnvelope" }],
      "properties": {
        "value": {
          "oneOf": [
            { "type": "null" },
            { "$ref": "#/$defs/generationSupplierValue" }
          ]
        }
      }
    },
    "city": { "$ref": "#/$defs/stringField" },
    "county": { "$ref": "#/$defs/stringField" },
    "permit_authority": { "$ref": "#/$defs/stringField" },
    "permit_url": { "$ref": "#/$defs/urlField" },
    "interconnection_url": { "$ref": "#/$defs/urlField" },

    "battery_programs": { "$ref": "#/$defs/programArrayField" },
    "rebates": { "$ref": "#/$defs/programArrayField" },

    "required_documents": {
      "allOf": [{ "$ref": "#/$defs/fieldEnvelope" }],
      "properties": {
        "value": {
          "oneOf": [
            { "type": "null" },
            { "type": "array", "items": { "$ref": "#/$defs/requiredDocumentItem" } }
          ]
        }
      }
    },
    "inspection_steps": { "$ref": "#/$defs/stringArrayField" },

    "timeline_days": {
      "allOf": [{ "$ref": "#/$defs/fieldEnvelope" }],
      "properties": {
        "value": {
          "oneOf": [
            { "type": "null" },
            {
              "type": "object",
              "additionalProperties": false,
              "properties": {
                "min_days": { "type": ["integer", "null"], "minimum": 0, "description": "Lower bound for the residential permit-review headline only. Do not combine residential and commercial figures into one range." },
                "max_days": { "type": ["integer", "null"], "minimum": 0, "description": "Upper bound for the residential permit-review headline only. Commercial or non-residential figures may remain in notes as clearly labelled context, but must not widen this bound." },
                "notes": { "type": ["string", "null"] }
              },
              "required": ["min_days", "max_days", "notes"]
            }
          ]
        }
      }
    },

    "eligibility_constraints": {
      "allOf": [{ "$ref": "#/$defs/fieldEnvelope" }],
      "properties": {
        "value": {
          "oneOf": [
            { "type": "null" },
            { "$ref": "#/$defs/eligibilityConstraintsValue" }
          ]
        }
      }
    },

    "permit_fees": {
      "allOf": [{ "$ref": "#/$defs/fieldEnvelope" }],
      "properties": {
        "value": {
          "oneOf": [
            { "type": "null" },
            { "type": "array", "items": { "$ref": "#/$defs/feeItem" } }
          ]
        }
      }
    },

    "official_contacts": {
      "allOf": [{ "$ref": "#/$defs/fieldEnvelope" }],
      "properties": {
        "value": {
          "oneOf": [
            { "type": "null" },
            { "type": "array", "items": { "$ref": "#/$defs/contactItem" } }
          ]
        }
      }
    },

    "last_verified": {
      "type": ["string", "null"],
      "format": "date",
      "description": "Record-level: date this record was last researched/verified. Null only for a record that has never been run."
    },

    "sources": {
      "type": "array",
      "description": "Shared citation registry for this record. Every source_ids entry anywhere in this record must resolve to an id in this array.",
      "items": { "$ref": "#/$defs/source" }
    }
  },

  "$defs": {
    "confidenceScore": {
      "type": "number",
      "minimum": 0,
      "maximum": 1,
      "description": "0 = unknown/unverified. 1 = directly confirmed on a Tier-1 official source within 90 days. See agents/data-collector.md for the full scale."
    },

    "sourceIds": {
      "type": "array",
      "items": { "type": "string" },
      "description": "References into this record's top-level `sources[].id`. Must be empty when confidence is 0 / value is null.",
      "default": []
    },

    "fieldEnvelope": {
      "type": "object",
      "additionalProperties": false,
      "required": ["value", "confidence", "source_ids"],
      "properties": {
        "value": {},
        "confidence": { "$ref": "#/$defs/confidenceScore" },
        "source_ids": { "$ref": "#/$defs/sourceIds" },
        "notes": { "type": ["string", "null"] }
      },
      "if": {
        "properties": { "value": { "type": "null" } },
        "required": ["value"]
      },
      "else": {
        "description": "value is non-null: enforces the agent rule 'every non-null field must have a source'.",
        "properties": { "source_ids": { "minItems": 1 } }
      }
    },

    "stringField": {
      "allOf": [{ "$ref": "#/$defs/fieldEnvelope" }],
      "properties": { "value": { "type": ["string", "null"] } }
    },

    "urlField": {
      "allOf": [{ "$ref": "#/$defs/fieldEnvelope" }],
      "properties": { "value": { "type": ["string", "null"], "format": "uri" } }
    },

    "stringArrayField": {
      "allOf": [{ "$ref": "#/$defs/fieldEnvelope" }],
      "properties": {
        "value": {
          "oneOf": [
            { "type": "null" },
            { "type": "array", "items": { "type": "string" } }
          ]
        }
      }
    },

    "programArrayField": {
      "allOf": [{ "$ref": "#/$defs/fieldEnvelope" }],
      "properties": {
        "value": {
          "oneOf": [
            { "type": "null" },
            { "type": "array", "items": { "$ref": "#/$defs/programItem" } }
          ]
        }
      }
    },

    "programItem": {
      "type": "object",
      "additionalProperties": false,
      "required": ["name", "effective_from", "expires_on", "status"],
      "properties": {
        "name": { "type": "string" },
        "administrator": { "type": ["string", "null"] },
        "description": { "type": ["string", "null"] },
        "value_usd_per_kwh": { "type": ["number", "null"] },
        "value_usd_flat": { "type": ["number", "null"] },
        "value_usd_per_watt": {
          "type": ["number", "null"],
          "minimum": 0,
          "description": "Dollars per Watt of installed capacity, e.g. a per-watt solar rebate ($0.60/W). Distinct unit from value_usd_per_kwh (battery capacity) and value_usd_flat — do not convert between them. Null if not applicable to this item."
        },
        "eligibility": { "type": ["string", "null"] },
        "url": { "type": ["string", "null"], "format": "uri" },
        "effective_from": {
          "type": ["string", "null"],
          "format": "date",
          "description": "ISO date this program/tier's terms took effect, if stated by a source. Null if unknown."
        },
        "expires_on": {
          "type": ["string", "null"],
          "format": "date",
          "description": "ISO date this program/tier's terms end, if stated by a source. Null if unknown or open-ended."
        },
        "status": {
          "type": "string",
          "enum": ["active", "expired", "unknown"],
          "description": "'active'/'expired' only when a source directly supports it (e.g. an explicit expires_on date has passed, or a source states current status). Otherwise 'unknown' — never inferred from silence."
        }
      }
    },

    "requiredDocumentItem": {
      "type": "object",
      "additionalProperties": false,
      "required": ["name", "source_ids"],
      "properties": {
        "name": { "type": "string" },
        "required_when": {
          "type": ["string", "null"],
          "description": "Condition under which this document is required (e.g. 'always', 'commercial/multifamily only'). Null if not specified by the source."
        },
        "source_ids": { "$ref": "#/$defs/sourceIds" }
      }
    },

    "generationSupplierValue": {
      "type": "object",
      "additionalProperties": false,
      "required": ["name", "type", "notes"],
      "properties": {
        "name": { "type": ["string", "null"] },
        "type": {
          "type": "string",
          "enum": ["cca", "utility", "other"],
          "description": "'cca' = Community Choice Aggregation (e.g. Ava Community Energy/EBCE), 'utility' = the same entity as the record's `utility` field generates by default, 'other' = neither (e.g. direct access)."
        },
        "notes": { "type": ["string", "null"] }
      }
    },

    "eligibilityConstraintsValue": {
      "type": "object",
      "additionalProperties": false,
      "required": [
        "property_types",
        "system_size_kw_ac_max",
        "system_size_kw_dc_max",
        "thermal_capacity_kw_max",
        "program_or_pathway",
        "other_conditions"
      ],
      "properties": {
        "property_types": {
          "type": "array",
          "items": { "type": "string" },
          "description": "Property types this rule set applies to, e.g. ['single-family', 'duplex']. Empty array if not specified/limited by the source."
        },
        "system_size_kw_ac_max": { "type": ["number", "null"], "description": "Max system AC capacity in kW for this rule set to apply, if stated. Null if unstated." },
        "system_size_kw_dc_max": { "type": ["number", "null"], "description": "Max system DC capacity in kW for this rule set to apply, if stated. Null if unstated." },
        "thermal_capacity_kw_max": { "type": ["number", "null"], "description": "Max thermal capacity in kW for this rule set to apply (solar thermal/water heating), if stated. Null if unstated." },
        "program_or_pathway": { "type": ["string", "null"], "description": "Name of the expedited program/permitting pathway this rule set belongs to, e.g. 'Instant Solar Permit (ISP) / SolarAPP+'. Null if not a named pathway." },
        "other_conditions": {
          "type": "array",
          "items": { "type": "string" },
          "description": "Any other stated conditions not captured by the structured fields above. Empty array if none."
        }
      }
    },

    "feeItem": {
      "type": "object",
      "additionalProperties": false,
      "required": ["name"],
      "properties": {
        "name": { "type": "string" },
        "amount_usd": { "type": ["number", "null"] },
        "unit": { "type": ["string", "null"] },
        "notes": { "type": ["string", "null"] }
      }
    },

    "contactItem": {
      "type": "object",
      "additionalProperties": false,
      "properties": {
        "name": { "type": ["string", "null"] },
        "role": { "type": ["string", "null"] },
        "phone": { "type": ["string", "null"] },
        "email": { "type": ["string", "null"] },
        "url": { "type": ["string", "null"], "format": "uri" }
      }
    },

    "source": {
      "type": "object",
      "additionalProperties": false,
      "required": ["id", "url", "type", "accessed_date"],
      "properties": {
        "id": { "type": "string" },
        "title": { "type": ["string", "null"] },
        "url": { "type": "string", "format": "uri" },
        "publisher": { "type": ["string", "null"] },
        "type": {
          "type": "string",
          "enum": ["government", "utility", "cpuc", "puc", "program_administrator", "other_official"],
          "description": "'cpuc' = California Public Utilities Commission specifically (kept for backward compatibility with existing CA records). 'puc' = any state's public utilities/service commission generically (use this for RI/DE/VT/etc. — e.g. Rhode Island PUC, Delaware PSC, Vermont PUC)."
        },
        "accessed_date": { "type": "string", "format": "date" }
      }
    }
  }
}
