{
  "record_id": "ca-kern-bakersfield-pge",
  "schema_version": "1.4.0",
  "state": "CA",
  "utility": {
    "value": "Pacific Gas & Electric (PG&E)",
    "confidence": 0.85,
    "source_ids": [
      "S1"
    ],
    "notes": "Bakersfield is a well-documented Kern County city; the city proper is within PG&E's core Northern/Central California service territory (note: SCE serves parts of eastern Kern County, but not the city of Bakersfield itself)."
  },
  "generation_supplier": {
    "value": null,
    "confidence": 0,
    "source_ids": [],
    "notes": "No Community Choice Aggregator was found confirmed to serve Bakersfield or Kern County this session."
  },
  "city": {
    "value": "Bakersfield",
    "confidence": 1,
    "source_ids": [
      "S1"
    ]
  },
  "county": {
    "value": "Kern County",
    "confidence": 0.9,
    "source_ids": [
      "S1"
    ]
  },
  "permit_authority": {
    "value": "City of Bakersfield Development Services Department, Building Division",
    "confidence": 0.8,
    "source_ids": [
      "S1"
    ]
  },
  "permit_url": {
    "value": "https://www.bakersfieldcity.us/building-division",
    "confidence": 0.8,
    "source_ids": [
      "S1"
    ],
    "notes": "The Building Division's own Forms page (linked from this hub) hosts a dedicated 'Expedited Residential Solar Installation' PV Toolkit document set (S4), directly confirming the solar-specific detail below."
  },
  "interconnection_url": {
    "value": "https://www.pge.com/en/save-energy-and-money/rebates-and-incentives/nem.html",
    "confidence": 0.55,
    "source_ids": [
      "S2"
    ],
    "notes": "PG&E's own utility-wide Net Energy Metering (NEM) program page."
  },
  "battery_programs": {
    "value": [
      {
        "name": "California SGIP - current category and budget check required",
        "administrator": "Applicable SGIP Program Administrator",
        "description": "New applications and waitlist applications for ratepayer-funded SGIP budgets closed on December 30, 2025. New AB 209 applications have a June 30, 2028 deadline. The 2026 SGIP rate table publishes $3.10/W for solar and $1.10/Wh for storage in applicable Residential Solar and Storage Equity categories. Household eligibility and live budget availability vary by category and program administrator; check the official Program Metrics tracker before relying on an incentive.",
        "value_usd_per_kwh": 1100,
        "value_usd_flat": null,
        "value_usd_per_watt": 3.1,
        "eligibility": "Eligibility varies by 2026 SGIP budget category, program administrator, property, income/pathway, project rules, and live funding availability.",
        "url": "https://www.selfgenca.com/home/program_metrics/",
        "effective_from": null,
        "expires_on": null,
        "status": "unknown"
      }
    ],
    "confidence": 0.9,
    "source_ids": [
      "S3",
      "SGIP_HANDBOOK_2026",
      "SGIP_METRICS_2026"
    ],
    "notes": "SGIP program data refreshed on 2026-08-26 from the official 2026 Handbook and live Program Metrics. Earlier locality records contained 2025 opening/availability language. This record does not assert household eligibility, reservation availability, or a guaranteed incentive; current category and program-administrator status must be checked before reliance."
  },
  "required_documents": {
    "value": [
      {
        "name": "Completed permit application form",
        "required_when": "always",
        "source_ids": [
          "S4"
        ]
      },
      {
        "name": "Demonstrated compliance with the Eligibility Checklist for expedited permitting",
        "required_when": "conditional",
        "source_ids": [
          "S4"
        ]
      },
      {
        "name": "Completed Standard Electrical Plan (for proposed solar installations 10kW or smaller)",
        "required_when": "conditional",
        "source_ids": [
          "S4"
        ]
      },
      {
        "name": "Roof plan showing roof layout, PV panels, and fire safety items (roof access point, code-compliant access pathways, PV fire classification, required labels/markings)",
        "required_when": "always",
        "source_ids": [
          "S4"
        ]
      },
      {
        "name": "Completed expedited Structural Criteria with required documentation (or, for non-qualifying systems, structural drawings/calculations stamped and signed by a California-licensed civil or structural engineer)",
        "required_when": "always",
        "source_ids": [
          "S4"
        ]
      }
    ],
    "confidence": 0.85,
    "source_ids": [
      "S4"
    ],
    "notes": "Per the City's own 'PV Toolkit Document #1: Submittal Requirements Bulletin' (expedited residential solar permitting, systems 10kW or smaller), linked from the Building Division's Forms page."
  },
  "inspection_steps": {
    "value": [
      "On-site inspections can be scheduled by calling the City of Bakersfield Building Division at 661-326-4677, or electronically via the Click2Gov permit-info portal",
      "Inspection requests received within business hours are scheduled for the next business day",
      "Permit holders must be prepared to show conformance with all technical requirements in the field at the time of inspection"
    ],
    "confidence": 0.85,
    "source_ids": [
      "S4"
    ],
    "notes": "Per the City's own 'PV Toolkit Document #1: Submittal Requirements Bulletin,' Section 5 (Inspections) — this is the City's PV-specific inspection-scheduling process, not a generic building-inspection page."
  },
  "timeline_days": {
    "value": {
      "min_days": 1,
      "max_days": 3,
      "notes": "The City's own 'PV Toolkit Document #1: Submittal Requirements Bulletin,' Section 3 (Plan Review), states: 'Permits will be reviewed in 1-3 days.' This directly confirms the figure previously derived from search-engine synthesis of the municipal code."
    },
    "confidence": 0.85,
    "source_ids": [
      "S4"
    ]
  },
  "eligibility_constraints": {
    "value": {
      "property_types": [
        "residential"
      ],
      "system_size_kw_ac_max": null,
      "system_size_kw_dc_max": null,
      "thermal_capacity_kw_max": null,
      "program_or_pathway": "Small Residential Rooftop Solar System Requirements (Bakersfield Municipal Code 15.56.030)",
      "other_conditions": []
    },
    "confidence": 0.5,
    "source_ids": [
      "S1"
    ]
  },
  "permit_fees": {
    "value": [
      {
        "name": "Expedited Solar PV Permit (systems 10kW or smaller)",
        "amount_usd": 187,
        "unit": "flat fee",
        "notes": "Per the City's own 'PV Toolkit Document #1: Submittal Requirements Bulletin,' Section 4 (Fees): 'Solar Permit fees using this process are $187.00.'"
      }
    ],
    "confidence": 0.8,
    "source_ids": [
      "S4"
    ]
  },
  "rebates": {
    "value": null,
    "confidence": 0,
    "source_ids": []
  },
  "official_contacts": {
    "value": [
      {
        "name": null,
        "role": "City of Bakersfield Building Division",
        "phone": "661-326-4677",
        "email": null,
        "url": "https://www.bakersfieldcity.us/building-division"
      }
    ],
    "confidence": 0.75,
    "source_ids": [
      "S1"
    ]
  },
  "last_verified": "2026-08-10",
  "sources": [
    {
      "id": "S1",
      "title": "Building Division",
      "url": "https://www.bakersfieldcity.us/building-division",
      "publisher": "City of Bakersfield",
      "type": "government",
      "accessed_date": "2026-08-10"
    },
    {
      "id": "S2",
      "title": "Net Energy Metering (NEM)",
      "url": "https://www.pge.com/en/save-energy-and-money/rebates-and-incentives/nem.html",
      "publisher": "Pacific Gas & Electric",
      "type": "utility",
      "accessed_date": "2026-08-09"
    },
    {
      "id": "S3",
      "title": "About",
      "url": "https://www.selfgenca.com/home/about/",
      "publisher": "Self-Generation Incentive Program (SGIP)",
      "type": "cpuc",
      "accessed_date": "2026-08-09"
    },
    {
      "id": "S4",
      "title": "PV Toolkit Document #1: Submittal Requirements Bulletin (Expedited Residential Solar Installation)",
      "url": "https://content.civicplus.com/api/assets/ca-bakersfield/a531a051-d462-4974-ac9d-d8eb4ac9067a?cache=1800",
      "publisher": "City of Bakersfield",
      "type": "government",
      "accessed_date": "2026-08-10"
    },
    {
      "id": "SGIP_HANDBOOK_2026",
      "title": "2026 Self-Generation Incentive Program Handbook",
      "url": "https://www.selfgenca.com/documents/handbook/2026",
      "publisher": "Self-Generation Incentive Program Program Administrators",
      "type": "program_administrator",
      "accessed_date": "2026-08-26"
    },
    {
      "id": "SGIP_METRICS_2026",
      "title": "SGIP Program Metrics and Incentive Step Tracker",
      "url": "https://www.selfgenca.com/home/program_metrics/",
      "publisher": "Self-Generation Incentive Program Program Administrators",
      "type": "program_administrator",
      "accessed_date": "2026-08-26"
    }
  ]
}
